{
  "schema_version": "devseek.external-authority-requests/v1",
  "integrity": {
    "hash_algorithm": "sha256",
    "canonicalization_version": "devseek-canonical-json/v1"
  },
  "request_set_id": "DEVSEEK-GATE0-EXTERNAL-AUTHORITY-REQUESTS/v1",
  "request_set_version": 1,
  "source_status": "generated-awaiting-external-authority",
  "integrity_scope": "external-authority-request-generation",
  "qualification_eligible": false,
  "qualification_effect": "NONE",
  "claims_permitted": false,
  "asserts_gate_pass": false,
  "sources": {
    "gate0_decision": {
      "path": "docs/process/devseek-gate0-decision-report.json",
      "schema_version": "devseek.gate0-decision/v1",
      "decision_id": "DEVSEEK-GATE0-INFRASTRUCTURE-DECISION/v1",
      "source_sha256": "c84377bf6d5cb49ef47c7c30a5d06ffa735200feb0a2b03a7b18a35ec5756e0b"
    },
    "external_authority_adapter": {
      "path": "docs/process/devseek-external-authority-adapter.json",
      "schema_version": "devseek.external-authority-adapter/v1",
      "adapter_id": "DEVSEEK-GATE0-EXTERNAL-AUTHORITY-ADAPTER/v1",
      "source_sha256": "aa2a7a9b4aa3a8471d93f034d56f3af7140b677cc6c7a2e9d087068799bb0f72"
    },
    "c0_wiring_reconciliation": {
      "path": "docs/process/devseek-c0-wiring-reconciliation.json",
      "schema_version": "devseek.c0-wiring-reconciliation/v1",
      "reconciliation_id": "DEVSEEK-GATE0-C0-WIRING-RECONCILIATION/v1",
      "source_sha256": "d95a3559a9b0d53b8197f481dace9ea99850302a4840e5cd4dfdc33ed369abab"
    },
    "package_scripts": {
      "path": "package.json",
      "source_sha256": "d31cab51401797bdb7f501f833a396f2fbdf23172e67623025bd9e1180a05ffa",
      "required_script": "verify:external-authority-requests",
      "required_script_present": true
    },
    "phase_gate_source": {
      "path": "scripts/devseek-phase0-12-verify.mjs",
      "source_sha256": "db927db5c6d2bf78ba78e62075bdde17a39c26ccdb41fef9f1847bd496b48702",
      "required_gate": "external-authority-request-packets",
      "required_gate_present": true
    },
    "checker_source": {
      "path": "scripts/devseek-external-authority-requests-check.mjs",
      "source_sha256": "95ef3a7b6b38774c793e1b2e367d791d9a6adc0acad16d8d3327e30ec761c6ee"
    },
    "oracle_source": {
      "path": "scripts/test/devseek-external-authority-requests.test.mjs",
      "source_sha256": "f42adab64a364088cae93ab9302a544bba83a08498c8d5115b3e7dcbf0e57c98"
    }
  },
  "request_contract": {
    "schema_version": "devseek.external-authority-request/v1",
    "required_fields": [
      "request_id",
      "atomic_id",
      "requesting_owner",
      "independent_decision_owner",
      "requested_decision_and_scope",
      "required_input_digests",
      "required_artifact_schema_and_signature_purpose",
      "trusted_root_or_registry_reference",
      "role_separation_and_conflict_rules",
      "valid_from",
      "expires_at",
      "revocation_source",
      "repository_import_port_and_fail_closed_verifier",
      "redaction_and_secret_non_observation",
      "terminal_state"
    ],
    "allowed_terminal_states": [
      "APPROVED",
      "DENIED",
      "EXPIRED",
      "BLOCKED"
    ],
    "requested_atomic_ids": [
      "EXT-01-SOURCE-REGISTRY-BINDING",
      "EXT-02-INDEPENDENT-ATTESTATION",
      "EXT-03-PROTECTED-PROFILE-POLICY",
      "EXT-04-ROLES-KEYS",
      "EXT-05-RETENTION-TIME"
    ],
    "repository_may_decide": false,
    "local_fixture_may_substitute": false,
    "markdown_may_approve": false
  },
  "gate0_current_state": {
    "status": "NOT_PASSED",
    "gate_passed": false,
    "external_authority_trust_anchored": false,
    "implementation_requirements_satisfied": 7,
    "exact_claim_requirements_satisfied": 0,
    "observed_claims": 0,
    "repository_pending_blockers": 0,
    "external_authority_blockers": 6,
    "claims_empty": true
  },
  "requests": [
    {
      "schema_version": "devseek.external-authority-request/v1",
      "request_id": "EXT-01-SOURCE-REGISTRY-BINDING/request-v1",
      "atomic_id": "EXT-01-SOURCE-REGISTRY-BINDING",
      "requesting_owner": "DevSeek local convergence runner",
      "independent_decision_owner": "registry-owner",
      "requested_decision_and_scope": {
        "decision": "Approve profile and evidence registry digests, versions, and revocation policy for Gate 0 protected qualification.",
        "scope": "gate0-protected-profile-execution-prerequisite",
        "external_delivery": "Independently approved profile/evidence registry digests with version and revocation policy.",
        "repository_may_decide": false,
        "qualification_claim_effect": "NONE"
      },
      "required_input_digests": [
        {
          "input_id": "gate0-decision-report",
          "path": "docs/process/devseek-gate0-decision-report.json",
          "sha256": "c84377bf6d5cb49ef47c7c30a5d06ffa735200feb0a2b03a7b18a35ec5756e0b",
          "purpose": "current Gate 0 machine decision and blocker counts"
        },
        {
          "input_id": "external-authority-adapter",
          "path": "docs/process/devseek-external-authority-adapter.json",
          "sha256": "aa2a7a9b4aa3a8471d93f034d56f3af7140b677cc6c7a2e9d087068799bb0f72",
          "purpose": "fail-closed external authority import adapter"
        },
        {
          "input_id": "c0-wiring-reconciliation",
          "path": "docs/process/devseek-c0-wiring-reconciliation.json",
          "sha256": "d95a3559a9b0d53b8197f481dace9ea99850302a4840e5cd4dfdc33ed369abab",
          "purpose": "local C0 wiring and decision reconciliation"
        },
        {
          "input_id": "capability-ledger-source",
          "path": "docs/process/devseek-capability-ledger.json",
          "sha256": "85e7f728d80f75ce1421f2e41eb9c22ce70feb5be6f41bc454bf4b671ef7c771",
          "purpose": "C0 capability source digest"
        },
        {
          "input_id": "qualification-profile-source",
          "path": "docs/process/devseek-qualification-profiles.json",
          "sha256": "2d9a678b096c3b1ba089d74d957ff8721fb2af24dfd00d57318eb3af7a3b644f",
          "purpose": "qualification profile source digest requested for external binding"
        },
        {
          "input_id": "qualification-evidence-source",
          "path": "docs/process/devseek-qualification-aggregator-policy.json",
          "sha256": "eeac897a3cc23b85cd3315d09e8619608f2e174e3101a7081d3c28d785465697",
          "purpose": "evidence policy source digest requested for external binding"
        }
      ],
      "required_artifact_schema_and_signature_purpose": {
        "schema_version": "devseek.external-authority-attestation/v1",
        "schema_path": "docs/process/devseek-external-authority-attestation.schema.json",
        "signature_purpose": "source-registry-digest-binding",
        "detached_signature_required": true
      },
      "trusted_root_or_registry_reference": {
        "status": "required-external-not-present",
        "reference": "external-profile-and-evidence-registry",
        "local_fallback_accepted": false
      },
      "role_separation_and_conflict_rules": [
        "registry owner must be independent from repository implementer",
        "registry digest approval must bind exact source digests",
        "revocation source must be external to this repository"
      ],
      "valid_from": null,
      "expires_at": null,
      "revocation_source": null,
      "repository_import_port_and_fail_closed_verifier": {
        "adapter_report_path": "docs/process/devseek-external-authority-adapter.json",
        "attestation_schema_path": "docs/process/devseek-external-authority-attestation.schema.json",
        "adapter_checker": "scripts/devseek-external-authority-adapter-check.mjs",
        "gate0_decision_checker": "scripts/devseek-gate0-decision-check.mjs",
        "fail_closed_without_external_artifact": true
      },
      "redaction_and_secret_non_observation": {
        "secret_material_must_not_enter_repository": true,
        "secret_values_observed_by_request_generator": false,
        "redaction_required_for_external_receipts": true
      },
      "terminal_state": "BLOCKED",
      "blocker_reason": "external-decision-artifact-not-provided",
      "qualification_effect": "NONE",
      "claims_permitted": false,
      "asserts_gate_pass": false
    },
    {
      "schema_version": "devseek.external-authority-request/v1",
      "request_id": "EXT-02-INDEPENDENT-ATTESTATION/request-v1",
      "atomic_id": "EXT-02-INDEPENDENT-ATTESTATION",
      "requesting_owner": "DevSeek local convergence runner",
      "independent_decision_owner": "independent-attestation-security-authority",
      "requested_decision_and_scope": {
        "decision": "Issue verifiable external authority attestation and trusted root for Gate 0 protected qualification.",
        "scope": "gate0-protected-profile-execution-prerequisite",
        "external_delivery": "Verifiable external authority attestation and trusted root.",
        "repository_may_decide": false,
        "qualification_claim_effect": "NONE"
      },
      "required_input_digests": [
        {
          "input_id": "gate0-decision-report",
          "path": "docs/process/devseek-gate0-decision-report.json",
          "sha256": "c84377bf6d5cb49ef47c7c30a5d06ffa735200feb0a2b03a7b18a35ec5756e0b",
          "purpose": "current Gate 0 machine decision and blocker counts"
        },
        {
          "input_id": "external-authority-adapter",
          "path": "docs/process/devseek-external-authority-adapter.json",
          "sha256": "aa2a7a9b4aa3a8471d93f034d56f3af7140b677cc6c7a2e9d087068799bb0f72",
          "purpose": "fail-closed external authority import adapter"
        },
        {
          "input_id": "c0-wiring-reconciliation",
          "path": "docs/process/devseek-c0-wiring-reconciliation.json",
          "sha256": "d95a3559a9b0d53b8197f481dace9ea99850302a4840e5cd4dfdc33ed369abab",
          "purpose": "local C0 wiring and decision reconciliation"